{
  "ledger_schema_version": "1.0.0",
  "project": "Motion Studio Foundation",
  "policy": {
    "statement": "A claim is not treated as learned, trained, or validated unless its evidence and verification method are recorded.",
    "data_ingestion_claims_require": [
      "source",
      "license_review",
      "download_manifest",
      "normalization_report",
      "benchmark_results"
    ],
    "training_claims_require": [
      "dataset_version",
      "training_configuration",
      "model_artifact_digest",
      "evaluation_report"
    ]
  },
  "records": [
    {
      "id": "baseline.single-arm-renderer",
      "status": "verified_by_source_inspection",
      "claim": "The v0.3.0 baseline renders one articulated arm chain in renderCharacter and has no screen-left arm group.",
      "verification_method": "Static source inspection",
      "evidence": [
        {
          "revision": "65a898b53960641fc50e0e76c5713e0f5a067b0e",
          "path": "ffmpeg-motion-studio/foundation-v0-1/src/svg-renderer.mjs",
          "symbol": "renderCharacter"
        }
      ],
      "limitation": "This is a source-architecture finding, not a measure of every possible rendered frame."
    },
    {
      "id": "baseline.pose-quality-tautology",
      "status": "verified_by_source_inspection",
      "claim": "Baseline hand-aim validation compares angles derived from the same wrist-to-target vector used to construct handAngle, so it does not independently validate the rendered pointing gesture.",
      "verification_method": "Static source inspection",
      "evidence": [
        {
          "revision": "65a898b53960641fc50e0e76c5713e0f5a067b0e",
          "path": "ffmpeg-motion-studio/foundation-v0-1/src/motion-core.mjs",
          "symbol": "handAngle construction"
        },
        {
          "revision": "65a898b53960641fc50e0e76c5713e0f5a067b0e",
          "path": "ffmpeg-motion-studio/foundation-v0-1/src/pose-quality.mjs",
          "symbol": "evaluatePoseQuality"
        }
      ],
      "limitation": "This identifies a correlated metric design; visual review is still required."
    },
    {
      "id": "redesign.bilateral-contract",
      "status": "passed_ci",
      "claim": "Scene schema and regression tests require both screen-left and screen-right arms/hands plus torso, head and legs render groups.",
      "verification_method": "GitHub Actions workflow 39170991263: scene schema validation, evidence ledger validation, browser HTTP smoke test, node regression tests, seven synthetic benchmarks, raster diagnostic, Python schema tests, FFmpeg render/FFprobe, source packaging and artifact upload.",
      "evidence": [
        {
          "revision": "fef550f57b0aef9496462641260555301bc002d3",
          "path": "ffmpeg-motion-studio/foundation-v0-1/scenes/scene-001.json",
          "symbol": "quality_contract.required_render_groups",
          "url": "https://github.com/orionrayy/projects/actions/runs/39170991263"
        },
        {
          "revision": "fef550f57b0aef9496462641260555301bc002d3",
          "path": "ffmpeg-motion-studio/foundation-v0-1/tests/visual-contract.test.mjs",
          "symbol": "bilateral rig exists in both data and rendered SVG",
          "url": "https://github.com/orionrayy/projects/actions/runs/39170991263"
        },
        {
          "revision": "fef550f57b0aef9496462641260555301bc002d3",
          "path": "ffmpeg-motion-studio/foundation-v0-1/src/svg-renderer.mjs",
          "symbol": "renderScreenLeftArm and renderCharacter",
          "url": "https://github.com/orionrayy/projects/actions/runs/39170991263"
        }
      ],
      "limitation": "The CI proves that both arm chains exist in frame state and their required SVG groups render, and that both IK chains preserve segment lengths. It does not certify natural anatomy, artistic approval, collision-free silhouettes, or learned motion."
    },
    {
      "id": "data.external-datasets",
      "status": "not_performed",
      "claim": "No external motion/image dataset has been downloaded or ingested in this implementation stage.",
      "verification_method": "Implementation scope declaration",
      "evidence": [],
      "limitation": "No data-learning, training, fine-tuning, or improved model capability is claimed."
    },
    {
      "id": "data.model-training",
      "status": "not_performed",
      "claim": "No model training or fine-tuning has been performed as part of this code change.",
      "verification_method": "Implementation scope declaration",
      "evidence": [],
      "limitation": "The code remains a deterministic procedural 2D rig and motion model."
    },
    {
      "id": "quality.rendered-aim-from-svg",
      "status": "passed_ci",
      "claim": "The canonical 96-frame pilot checks the emitted SVG pointing-hand transform against deterministic pose state, including rendered aim, origin, fingertip and hand scale.",
      "verification_method": "GitHub Actions run 39212642233 on source revision c7641e25973969eb5ea51395f293d20f4cd8a26a passed: 31/31 Node tests, 96/96 serialized SVG frame checks, 7/7 synthetic motion scenarios, Python schema tests, FFmpeg export/ffprobe and source artifact packaging.",
      "evidence": [
        {
          "path": "ffmpeg-motion-studio/foundation-v0-1/src/rendered-pose-quality.mjs",
          "symbol": "evaluateRenderedPoseQuality",
          "revision": "c7641e25973969eb5ea51395f293d20f4cd8a26a",
          "url": "https://github.com/orionrayy/projects/actions/runs/39212642233"
        },
        {
          "path": "ffmpeg-motion-studio/foundation-v0-1/tests/visual-contract.test.mjs",
          "symbol": "serialized SVG hand aim and transform mutation regressions",
          "revision": "c7641e25973969eb5ea51395f293d20f4cd8a26a",
          "url": "https://github.com/orionrayy/projects/actions/runs/39212642233"
        }
      ],
      "limitation": "This verifies serialized geometry consistency, not natural motion, collision-free silhouettes, semantic correctness of arbitrary animation or artistic acceptance."
    }
  ]
}
